{
  "schema_version": "0.4.0",
  "selection_id": "normal-ja-selection.v1.candidate",
  "status": "candidate_selected",
  "selection_frozen": false,
  "execution_ready": false,
  "language": "ja",
  "selection_seed": "beaconbench-selection-v1",
  "case_count": 100,
  "selection_policy": {
    "target_results_used": false,
    "quick_is_subset": true,
    "trial_settings_embedded": false,
    "unavailable_assets_replaced": false,
    "source_content_review": "pending where dataset or Japanese assets are missing"
  },
  "cases": [
    {
      "id": "babel-claw-033b5523bdbbef",
      "source_id": "babel-claw",
      "native_id": "T014_meeting_notes",
      "domain": "general",
      "title": "meeting_notes",
      "difficulty": "unclassified",
      "quick": false,
      "language_status": "upstream_ja_assets_pending",
      "execution_ready": false,
      "readiness_gates": [
        "task_data_missing",
        "japanese_sidecar_missing",
        "text_and_web_dependency_review",
        "native_controls",
        "sandbox_reset"
      ],
      "source": {
        "repository": "QwenLM/BabelArena",
        "revision": "36960fbb7ee1aac5082fa7307264abc612a180f4",
        "path": "benchmarks/claw/task_subsets/standard/general.txt"
      },
      "selection_reason": "Text-office candidates cover mail, calendar, follow-up, notes, inventory, procurement, support, profit and reporting. Real-web/image dependencies still require content review.",
      "selection_basis": "source metadata; no target-model results"
    },
    {
      "id": "babel-claw-1f7b96d8c04495",
      "source_id": "babel-claw",
      "native_id": "T150_project_progress_report",
      "domain": "general",
      "title": "project_progress_report",
      "difficulty": "unclassified",
      "quick": false,
      "language_status": "upstream_ja_assets_pending",
      "execution_ready": false,
      "readiness_gates": [
        "task_data_missing",
        "japanese_sidecar_missing",
        "text_and_web_dependency_review",
        "native_controls",
        "sandbox_reset"
      ],
      "source": {
        "repository": "QwenLM/BabelArena",
        "revision": "36960fbb7ee1aac5082fa7307264abc612a180f4",
        "path": "benchmarks/claw/task_subsets/standard/general.txt"
      },
      "selection_reason": "Text-office candidates cover mail, calendar, follow-up, notes, inventory, procurement, support, profit and reporting. Real-web/image dependencies still require content review.",
      "selection_basis": "source metadata; no target-model results"
    },
    {
      "id": "babel-claw-2eb43aee01712a",
      "source_id": "babel-claw",
      "native_id": "T020_inventory_check",
      "domain": "general",
      "title": "inventory_check",
      "difficulty": "unclassified",
      "quick": false,
      "language_status": "upstream_ja_assets_pending",
      "execution_ready": false,
      "readiness_gates": [
        "task_data_missing",
        "japanese_sidecar_missing",
        "text_and_web_dependency_review",
        "native_controls",
        "sandbox_reset"
      ],
      "source": {
        "repository": "QwenLM/BabelArena",
        "revision": "36960fbb7ee1aac5082fa7307264abc612a180f4",
        "path": "benchmarks/claw/task_subsets/standard/general.txt"
      },
      "selection_reason": "Text-office candidates cover mail, calendar, follow-up, notes, inventory, procurement, support, profit and reporting. Real-web/image dependencies still require content review.",
      "selection_basis": "source metadata; no target-model results"
    },
    {
      "id": "babel-claw-45408c281b8542",
      "source_id": "babel-claw",
      "native_id": "T116_ticket_kb_suggestion",
      "domain": "general",
      "title": "ticket_kb_suggestion",
      "difficulty": "unclassified",
      "quick": false,
      "language_status": "upstream_ja_assets_pending",
      "execution_ready": false,
      "readiness_gates": [
        "task_data_missing",
        "japanese_sidecar_missing",
        "text_and_web_dependency_review",
        "native_controls",
        "sandbox_reset"
      ],
      "source": {
        "repository": "QwenLM/BabelArena",
        "revision": "36960fbb7ee1aac5082fa7307264abc612a180f4",
        "path": "benchmarks/claw/task_subsets/standard/general.txt"
      },
      "selection_reason": "Text-office candidates cover mail, calendar, follow-up, notes, inventory, procurement, support, profit and reporting. Real-web/image dependencies still require content review.",
      "selection_basis": "source metadata; no target-model results"
    },
    {
      "id": "babel-claw-691df97daf2179",
      "source_id": "babel-claw",
      "native_id": "T110_complaint_investigation",
      "domain": "general",
      "title": "complaint_investigation",
      "difficulty": "unclassified",
      "quick": false,
      "language_status": "upstream_ja_assets_pending",
      "execution_ready": false,
      "readiness_gates": [
        "task_data_missing",
        "japanese_sidecar_missing",
        "text_and_web_dependency_review",
        "native_controls",
        "sandbox_reset"
      ],
      "source": {
        "repository": "QwenLM/BabelArena",
        "revision": "36960fbb7ee1aac5082fa7307264abc612a180f4",
        "path": "benchmarks/claw/task_subsets/standard/general.txt"
      },
      "selection_reason": "Text-office candidates cover mail, calendar, follow-up, notes, inventory, procurement, support, profit and reporting. Real-web/image dependencies still require content review.",
      "selection_basis": "source metadata; no target-model results"
    },
    {
      "id": "babel-claw-8296dcf9d46955",
      "source_id": "babel-claw",
      "native_id": "T132_order_profit_analysis",
      "domain": "general",
      "title": "order_profit_analysis",
      "difficulty": "unclassified",
      "quick": false,
      "language_status": "upstream_ja_assets_pending",
      "execution_ready": false,
      "readiness_gates": [
        "task_data_missing",
        "japanese_sidecar_missing",
        "text_and_web_dependency_review",
        "native_controls",
        "sandbox_reset"
      ],
      "source": {
        "repository": "QwenLM/BabelArena",
        "revision": "36960fbb7ee1aac5082fa7307264abc612a180f4",
        "path": "benchmarks/claw/task_subsets/standard/general.txt"
      },
      "selection_reason": "Text-office candidates cover mail, calendar, follow-up, notes, inventory, procurement, support, profit and reporting. Real-web/image dependencies still require content review.",
      "selection_basis": "source metadata; no target-model results"
    },
    {
      "id": "babel-claw-85316b98f74661",
      "source_id": "babel-claw",
      "native_id": "T006_email_reply_draft",
      "domain": "general",
      "title": "email_reply_draft",
      "difficulty": "unclassified",
      "quick": true,
      "language_status": "upstream_ja_assets_pending",
      "execution_ready": false,
      "readiness_gates": [
        "task_data_missing",
        "japanese_sidecar_missing",
        "text_and_web_dependency_review",
        "native_controls",
        "sandbox_reset"
      ],
      "source": {
        "repository": "QwenLM/BabelArena",
        "revision": "36960fbb7ee1aac5082fa7307264abc612a180f4",
        "path": "benchmarks/claw/task_subsets/standard/general.txt"
      },
      "selection_reason": "Text-office candidates cover mail, calendar, follow-up, notes, inventory, procurement, support, profit and reporting. Real-web/image dependencies still require content review.",
      "selection_basis": "source metadata; no target-model results"
    },
    {
      "id": "babel-claw-ba4cff7afed205",
      "source_id": "babel-claw",
      "native_id": "T118_customer_followup",
      "domain": "general",
      "title": "customer_followup",
      "difficulty": "unclassified",
      "quick": true,
      "language_status": "upstream_ja_assets_pending",
      "execution_ready": false,
      "readiness_gates": [
        "task_data_missing",
        "japanese_sidecar_missing",
        "text_and_web_dependency_review",
        "native_controls",
        "sandbox_reset"
      ],
      "source": {
        "repository": "QwenLM/BabelArena",
        "revision": "36960fbb7ee1aac5082fa7307264abc612a180f4",
        "path": "benchmarks/claw/task_subsets/standard/general.txt"
      },
      "selection_reason": "Text-office candidates cover mail, calendar, follow-up, notes, inventory, procurement, support, profit and reporting. Real-web/image dependencies still require content review.",
      "selection_basis": "source metadata; no target-model results"
    },
    {
      "id": "babel-claw-d66f4ebea99821",
      "source_id": "babel-claw",
      "native_id": "T030_cross_service_meeting",
      "domain": "general",
      "title": "cross_service_meeting",
      "difficulty": "unclassified",
      "quick": true,
      "language_status": "upstream_ja_assets_pending",
      "execution_ready": false,
      "readiness_gates": [
        "task_data_missing",
        "japanese_sidecar_missing",
        "text_and_web_dependency_review",
        "native_controls",
        "sandbox_reset"
      ],
      "source": {
        "repository": "QwenLM/BabelArena",
        "revision": "36960fbb7ee1aac5082fa7307264abc612a180f4",
        "path": "benchmarks/claw/task_subsets/standard/general.txt"
      },
      "selection_reason": "Text-office candidates cover mail, calendar, follow-up, notes, inventory, procurement, support, profit and reporting. Real-web/image dependencies still require content review.",
      "selection_basis": "source metadata; no target-model results"
    },
    {
      "id": "babel-claw-ff0153779136c9",
      "source_id": "babel-claw",
      "native_id": "T036_vendor_procurement",
      "domain": "general",
      "title": "vendor_procurement",
      "difficulty": "unclassified",
      "quick": false,
      "language_status": "upstream_ja_assets_pending",
      "execution_ready": false,